,title,media,date,datetime,desc,link,img
0,Uber’s Self-Driving Cars Were Struggling Before Arizona Crash,The New York Times,"Mar 23, 2018",2018-03-23 00:00:00.000000,"And Uber's human drivers had to intervene far more frequently than the drivers of competing autonomous car projects. Waymo, formerly the self-driving car ...",https://www.nytimes.com/2018/03/23/technology/uber-self-driving-cars-arizona.html,"data:image/gif;base64,R0lGODlhAQABAIAAAP///////yH5BAEKAAEALAAAAAABAAEAAAICTAEAOw=="
1,"Uber, Arizona, and the Limits of Self-Driving Cars",The Atlantic,"th · Mar 20, 2018",2018-03-20 00:00:00.000000,"Autonomous vehicles generally use deep neural network algorithms to “recognize” images. The car's LIDAR recognizes an obstacle, the camera takes a picture of it ...",https://www.theatlantic.com/technology/archive/2018/03/uber-self-driving-fatality-arizona/556001/,"data:image/gif;base64,R0lGODlhAQABAIAAAP///////yH5BAEKAAEALAAAAAABAAEAAAICTAEAOw=="
2,Americans had concerns about self-driving cars before fatal ...,Pew Research Center,"Mar 21, 2018",2018-03-21 00:00:00.000000,"Even before a driverless Uber vehicle struck and killed a pedestrian in Arizona this week, a slight majority of Americans said they were at least somewhat ...",https://www.pewresearch.org/fact-tank/2018/03/21/americans-had-concerns-about-self-driving-cars-before-fatal-arizona-accident/,"data:image/gif;base64,R0lGODlhAQABAIAAAP///////yH5BAEKAAEALAAAAAABAAEAAAICTAEAOw=="
3,How Driverless Cars See the World Around Them,The New York Times,"Mar 19, 2018",2018-03-19 00:00:00.000000,"Waymo, the self-driving car company owned by Google's parent company, Alphabet, has said it is also operating autonomous cars on the outskirts of Phoenix ...",https://www.nytimes.com/2018/03/19/technology/how-driverless-cars-work.html,"data:image/gif;base64,R0lGODlhAQABAIAAAP///////yH5BAEKAAEALAAAAAABAAEAAAICTAEAOw=="
4,Here’s how Uber’s self-driving cars are supposed to detect pedestrians,TechCrunch,"th · Mar 19, 2018",2018-03-19 00:00:00.000000,A self-driving vehicle made by Uber has struck and killed a pedestrian. ... is pretty much the first emergency event that autonomous car engineers look at.,https://techcrunch.com/2018/03/19/heres-how-ubers-self-driving-cars-are-supposed-to-detect-pedestrians/,"data:image/gif;base64,R0lGODlhAQABAIAAAP///////yH5BAEKAAEALAAAAAABAAEAAAICTAEAOw=="
5,Self-driving Uber kills Arizona woman in first fatal crash involving pedestrian,The Guardian,"Mar 19, 2018",2018-03-19 00:00:00.000000,"Tempe police said the self-driving car was in autonomous mode at the time of the crash and that the vehicle hit a woman, who was walking outside of the ...",https://www.theguardian.com/technology/2018/mar/19/uber-self-driving-car-kills-woman-arizona-tempe,"data:image/gif;base64,R0lGODlhAQABAIAAAP///////yH5BAEKAAEALAAAAAABAAEAAAICTAEAOw=="
6,Uber's First Self-Driving Fleet Arrives in Pittsburgh This Month,Bloomberg.com,"Aug 18, 2016",2016-08-18 00:00:00.000000,"The autonomous cars, launching this summer, are custom Volvo XC90s, ... self-driving car project, spent seven years researching autonomous robots at CMU, ...",https://www.bloomberg.com/news/features/2016-08-18/uber-s-first-self-driving-fleet-arrives-in-pittsburgh-this-month-is06r7on,"data:image/gif;base64,R0lGODlhAQABAIAAAP///////yH5BAEKAAEALAAAAAABAAEAAAICTAEAOw=="
7,Arizona Suspends Uber’s Autonomous Cars After a Death. What’s Next for Driverless Cars?,Greentech Media,"Mar 27, 2018",2018-03-27 00:00:00.000000,What's Next for Driverless Cars? Experts disagree over the cause—and consequences—of Uber's fatal accident last week. Lacey Johnson March 27 ...,https://www.greentechmedia.com/articles/read/uber-autonomous-cars-death,"data:image/gif;base64,R0lGODlhAQABAIAAAP///////yH5BAEKAAEALAAAAAABAAEAAAICTAEAOw=="
8,Uber’s self-driving cars start picking up passengers in San Francisco,TechCrunch,"Dec 14, 2016",2016-12-14 00:00:00.000000,"Uber's self-driving cars are making the move to San Francisco, in a new expansion of its pilot project with autonomous vehicles that will see Volvo SUVs ...",https://techcrunch.com/2016/12/14/ubers-self-driving-cars-start-picking-up-passengers-in-san-francisco/,"data:image/gif;base64,R0lGODlhAQABAIAAAP///////yH5BAEKAAEALAAAAAABAAEAAAICTAEAOw=="
9,It’s Elon Musk vs. everyone else in the race for fully driverless cars,The Verge,"Apr 24, 2019",2019-04-24 00:00:00.000000,"High-precision GPS maps for self-driving cars are a “really bad idea,” according to ... Also, Tesla will have its Level 5 autonomous vehicles that can drive ...",https://www.theverge.com/2019/4/24/18512580/elon-musk-tesla-driverless-cars-lidar-simulation-waymo,"data:image/gif;base64,R0lGODlhAQABAIAAAP///////yH5BAEKAAEALAAAAAABAAEAAAICTAEAOw=="
10,"Google Cars Drive Themselves, in Traffic",The New York Times,"Oct 9, 2010",2010-10-09 00:00:00.000000,"The only accident, engineers said, was when one Google car was rear-ended while stopped at a traffic light. Autonomous cars are years from mass production, but ...",https://www.nytimes.com/2010/10/10/science/10google.html,"data:image/gif;base64,R0lGODlhAQABAIAAAP///////yH5BAEKAAEALAAAAAABAAEAAAICTAEAOw=="
11,Google’s Next Phase in Driverless Cars: No Steering Wheel or Brake Pedals,The New York Times,"May 27, 2014",2014-05-27 00:00:00.000000,"The new Google strategy for autonomous cars is a break from many competing vehicle projects. Mercedes, BMW and Volvo have introduced cars that have the ...",https://www.nytimes.com/2014/05/28/technology/googles-next-phase-in-driverless-cars-no-brakes-or-steering-wheel.html,"data:image/gif;base64,R0lGODlhAQABAIAAAP///////yH5BAEKAAEALAAAAAABAAEAAAICTAEAOw=="
12,"Lyft, GM Teaming Up To Create Fleet Of Driverless Cars",NPR,"Jan 4, 2016",2016-01-04 00:00:00.000000,"If you hail a ride using the on-demand app Lyft, that car could one day be ... Although, when it comes to autonomous cars, Lyft and GM are not alone.",https://www.npr.org/sections/thetwo-way/2016/01/04/461922098/lyft-gm-teaming-up-to-create-fleet-of-driverless-cars,"data:image/gif;base64,R0lGODlhAQABAIAAAP///////yH5BAEKAAEALAAAAAABAAEAAAICTAEAOw=="
13,What It's Like To Ride In A (Nearly) Self-Driving Uber,NPR,"Sep 14, 2016",2016-09-14 00:00:00.000000,"Fourteen self-driving Ford Fusions idle in front of Uber's Advanced Technologies Center in Pittsburgh. On each vehicle, dozens of stationary and spinning ...",https://www.npr.org/sections/alltechconsidered/2016/09/14/493823483/self-driving-cars-take-to-the-streets-of-pittsburgh-courtesy-of-uber,"data:image/gif;base64,R0lGODlhAQABAIAAAP///////yH5BAEKAAEALAAAAAABAAEAAAICTAEAOw=="
14,Elon Musk: negative media coverage of autonomous vehicles could be ‘killing people’,The Verge,"Oct 19, 2016",2016-10-19 00:00:00.000000,"One of the early ones was straightforward: if an autonomous car crashes, will Tesla be liable? Specifically, would it “offer indemnity” to customers like ...",https://www.theverge.com/2016/10/19/13341306/elon-musk-negative-media-autonomous-vehicles-killing-people,"data:image/gif;base64,R0lGODlhAQABAIAAAP///////yH5BAEKAAEALAAAAAABAAEAAAICTAEAOw=="
15,The 15-Point Federal Checklist for Self-Driving Cars,The New York Times,"Sep 20, 2016",2016-09-20 00:00:00.000000,"In the guidelines, the United States Department of Transportation urged automakers and tech companies to prove that their semiautonomous and autonomous vehicles ...",https://www.nytimes.com/2016/09/21/technology/the-15-point-federal-checklist-for-self-driving-cars.html,"data:image/gif;base64,R0lGODlhAQABAIAAAP///////yH5BAEKAAEALAAAAAABAAEAAAICTAEAOw=="
16,Ford Promises Fleets of Driverless Cars Within Five Years,The New York Times,"Aug 16, 2016",2016-08-16 00:00:00.000000,"In the race to develop driverless cars, several automakers and technology companies are already testing vehicles that pilot themselves on public roads.",https://www.nytimes.com/2016/08/17/business/ford-promises-fleets-of-driverless-cars-within-five-years.html,"data:image/gif;base64,R0lGODlhAQABAIAAAP///////yH5BAEKAAEALAAAAAABAAEAAAICTAEAOw=="
17,Uber Sells Self-Driving Research Unit to Startup Aurora,NPR,"Dec 7, 2020",2020-12-07 00:00:00.000000,"Ride-hailing giant Uber is selling its autonomous vehicle research unit, Advanced Technologies Group, to the self-driving startup Aurora.",https://www.npr.org/2020/12/07/944004278/after-once-touting-self-driving-cars-uber-sells-unit-to-refocus-on-core-business,"data:image/gif;base64,R0lGODlhAQABAIAAAP///////yH5BAEKAAEALAAAAAABAAEAAAICTAEAOw=="
18,Self-driving cars a reality for 'ordinary people' within 5 years ...,,"Sep 25, 2012",2012-09-25 00:00:00.000000,"Such ""autonomous vehicles"" will be a reality for ""ordinary people"" in less than five years, Google co-founder Sergey Brin said Tuesday. He also said autonomous ...",https://www.computerworld.com/article/2491635/self-driving-cars-a-reality-for--ordinary-people--within-5-years--says-google-s-sergey-b.html,"data:image/gif;base64,R0lGODlhAQABAIAAAP///////yH5BAEKAAEALAAAAAABAAEAAAICTAEAOw=="
19,"Exclusive: In boost to self-driving cars, U.S. tells Google computers can qualify as drivers",Reuters,"Feb 9, 2016",2016-02-09 00:00:00.000000,... toward ultimately winning approval for autonomous vehicles on the roads. ... “We agree with Google its (self-driving car) will not have a 'driver' in ...,https://www.reuters.com/article/us-alphabet-autos-selfdriving-exclusive-idUSKCN0VJ00H,"data:image/gif;base64,R0lGODlhAQABAIAAAP///////yH5BAEKAAEALAAAAAABAAEAAAICTAEAOw=="
20,Elon Musk: Tesla Will Have Level 5 Self-Driving Cars This Year,Forbes,"Jul 9, 2020",2020-07-09 00:00:00.000000,"Tesla will have essentially fully autonomous self-driving vehicles this year, CEO Elon Musk said in a video recorded for a Chinese AI conference.",https://www.forbes.com/sites/johnkoetsier/2020/07/09/elon-musk-tesla-will-have-level-5-self-driving-cars-this-year/,"data:image/gif;base64,R0lGODlhAQABAIAAAP///////yH5BAEKAAEALAAAAAABAAEAAAICTAEAOw=="
21,Self-Driving Cars: 5 Problems That Need Solutions,Live Science,"May 14, 2015",2015-05-14 00:00:00.000000,"Still, while some levels of automation are already in existing cars, completely driverless cars — with no steering wheels or brakes for human drivers ...",https://www.livescience.com/50841-future-of-driverless-cars.html,"data:image/gif;base64,R0lGODlhAQABAIAAAP///////yH5BAEKAAEALAAAAAABAAEAAAICTAEAOw=="
22,Google says it bears 'some responsibility' after self-driving car hit bus,Reuters,"Feb 29, 2016",2016-02-29 00:00:00.000000,The crash may be the first case of one of its autonomous cars hitting another vehicle and the fault of the self-driving car.,https://www.reuters.com/article/us-google-selfdrivingcar-idUSKCN0W22DG,"data:image/gif;base64,R0lGODlhAQABAIAAAP///////yH5BAEKAAEALAAAAAABAAEAAAICTAEAOw=="
23,Germany to require 'black box' in autonomous cars,Reuters,"Jul 18, 2016",2016-07-18 00:00:00.000000,Germany to require 'black box' in autonomous cars ... The fatal crash of a Tesla Motors Inc Model S car in its Autopilot mode has increased the pressure on ...,https://www.reuters.com/article/us-germany-autos-idUSKCN0ZY1LT,"data:image/gif;base64,R0lGODlhAQABAIAAAP///////yH5BAEKAAEALAAAAAABAAEAAAICTAEAOw=="
24,Uber’s Self-Driving Cars Are Valued at $7.25 Billion by Investors,The New York Times,"Apr 18, 2019",2019-04-18 00:00:00.000000,"An autonomous Volvo being developed by Uber. SoftBank, Toyota and the Japanese automaker Denso will put $1 billion toward Uber's efforts for autonomous cars ...",https://www.nytimes.com/2019/04/18/technology/uber-atg-autonomous-cars-investment.html,"data:image/gif;base64,R0lGODlhAQABAIAAAP///////yH5BAEKAAEALAAAAAABAAEAAAICTAEAOw=="
25,Opinion | Autonomous Vehicles Take Another Big Leap,The New York Times,"Dec 14, 2020",2020-12-14 00:00:00.000000,"The Amazon-owned Zoox is unveiling an electric self-driving vehicle. But are we ready for driverless cars? Dec. 14, 2020.",https://www.nytimes.com/2020/12/14/opinion/Zoox-Amazon-self-driving.html,"data:image/gif;base64,R0lGODlhAQABAIAAAP///////yH5BAEKAAEALAAAAAABAAEAAAICTAEAOw=="
26,U.S. lets autonomous vehicle bypass human-driver safety rules,PBS,"Feb 6, 2020",2020-02-06 00:00:00.000000,The service was to start early this year and use the vehicles as well as automated Toyota Prius hybrid cars. Nuro also was testing deliveries with Kroger in ...,https://www.pbs.org/newshour/science/u-s-lets-autonomous-vehicle-bypass-human-driver-safety-rules,"data:image/gif;base64,R0lGODlhAQABAIAAAP///////yH5BAEKAAEALAAAAAABAAEAAAICTAEAOw=="
27,"Microsoft teams up with Cruise on self-driving cars, chips in for $2 billion investment",The Verge,"Jan 19, 2021",2021-01-19 00:00:00.000000,"Microsoft is joining forces with Cruise, the self-driving subsidiary of General Motors, to help speed up the commercialization of autonomous vehicles.",https://www.theverge.com/2021/1/19/22238407/microsoft-cruise-self-driving-investment-azure-cloud,"data:image/gif;base64,R0lGODlhAQABAIAAAP///////yH5BAEKAAEALAAAAAABAAEAAAICTAEAOw=="
28,"Amazon to Buy Zoox, in a Move Toward Self-Driving Cars",The New York Times,"Jun 26, 2020",2020-06-26 00:00:00.000000,"But Zoox's ambitions have focused on creating a new kind of autonomous car designed specifically for passenger rides without a driver, sometimes called a ...",https://www.nytimes.com/2020/06/26/business/amazon-zoox.html,"data:image/gif;base64,R0lGODlhAQABAIAAAP///////yH5BAEKAAEALAAAAAABAAEAAAICTAEAOw=="
29,Toyota to invest $500 million in Uber for self-driving cars,Reuters,"Aug 27, 2018",2018-08-27 00:00:00.000000,"Their deal deepens an existing relationship and reflects CEO Dara Khosrowshahi's strategy of Uber developing autonomous vehicles through partnerships, ...",https://www.reuters.com/article/us-uber-toyota-idUSKCN1LC203,"data:image/gif;base64,R0lGODlhAQABAIAAAP///////yH5BAEKAAEALAAAAAABAAEAAAICTAEAOw=="
30,Competing With the Giants in Race to Build Self-Driving Cars,The New York Times,"Jan 4, 2018",2018-01-04 00:00:00.000000,"Sterling Anderson, left, and Chris Urmson at Aurora Innovation, a start-up founded by three veterans of autonomous vehicle research, including Mr. Urmson.",https://www.nytimes.com/2018/01/04/technology/self-driving-cars-aurora.html,"data:image/gif;base64,R0lGODlhAQABAIAAAP///////yH5BAEKAAEALAAAAAABAAEAAAICTAEAOw=="
31,Florida Law To Allow Autonomous Cars - When They're Ready,WUSF News,"Jun 14, 2019",2019-06-14 00:00:00.000000,"Las Vegas and other cities have used autonomous vehicles with human ""safety drivers"" in case of a vehicle malfunction. Florida's new law will allow self-driving ...",https://wusfnews.wusf.usf.edu/transportation/2019-06-14/florida-law-to-allow-autonomous-cars-when-theyre-ready,"data:image/gif;base64,R0lGODlhAQABAIAAAP///////yH5BAEKAAEALAAAAAABAAEAAAICTAEAOw=="
32,Driverless Cars: What Could Possibly Go Wrong?,Harvard Business Review,"Jan 15, 2016",2016-01-15 00:00:00.000000,"There sure is a lot of hype around autonomous cars. Tech firms love the concept — the vehicle is a mobile IT platform like no other. By and large, journalists ...",https://hbr.org/2016/01/driverless-cars-what-could-possibly-go-wrong,"data:image/gif;base64,R0lGODlhAQABAIAAAP///////yH5BAEKAAEALAAAAAABAAEAAAICTAEAOw=="
33,Waymo gets the green light to test fully driverless cars in California,The Verge,"Oct 30, 2018",2018-10-30 00:00:00.000000,"Waymo's driverless vehicles will operate in the shaded area. Waymo's permit includes day and night testing on city streets, rural roads, and highways with ...",https://www.theverge.com/2018/10/30/18044670/waymo-fully-driverless-car-permit-california-dmv,"data:image/gif;base64,R0lGODlhAQABAIAAAP///////yH5BAEKAAEALAAAAAABAAEAAAICTAEAOw=="
34,Google reports self-driving car mistakes: 272 failures and 13 near misses,The Guardian,"Jan 12, 2016",2016-01-12 00:00:00.000000,"The figures show that during the 14-month period, 49 Google self-driving cars racked up over 424,000 autonomous miles and suffered 341 disengagements, when ...",https://www.theguardian.com/technology/2016/jan/12/google-self-driving-cars-mistakes-data-reports,"data:image/gif;base64,R0lGODlhAQABAIAAAP///////yH5BAEKAAEALAAAAAABAAEAAAICTAEAOw=="
35,Lyft's president says 'majority' of rides will be in self-driving cars by 2021,The Verge,"Sep 18, 2016",2016-09-18 00:00:00.000000,"Or you can own a private vehicle."" Lyft will operate as a hybrid network, with drivers using autonomous vehicles, until the technology advances to the point ...",https://www.theverge.com/2016/9/18/12944506/lyft-self-driving-car-prediction-2021-john-zimmer,"data:image/gif;base64,R0lGODlhAQABAIAAAP///////yH5BAEKAAEALAAAAAABAAEAAAICTAEAOw=="
36,Uber Opening Robotics Research Facility In Pittsburgh To Build Self-Driving Cars,TechCrunch,"Feb 2, 2015",2015-02-02 00:00:00.000000,"Uber will be developing the core technology, the vehicles, and associated ... which is very interesting considering Uber's interest in automated vehicles.",https://techcrunch.com/2015/02/02/uber-opening-robotics-research-facility-in-pittsburgh-to-build-self-driving-cars/,"data:image/gif;base64,R0lGODlhAQABAIAAAP///////yH5BAEKAAEALAAAAAABAAEAAAICTAEAOw=="
37,"Starting with Michigan, Sidewalk Infrastructure is looking to build roads specifically for autonomous cars",TechCrunch,"Aug 13, 2020",2020-08-13 00:00:00.000000,"... Infrastructure is looking to build roads specifically for autonomous cars ... and Ann Arbor, Michigan that will be dedicated to autonomous vehicles.",https://techcrunch.com/2020/08/13/starting-with-michigan-sidewalk-infrastructure-is-looking-to-build-roads-specifically-for-autonomous-cars/,"data:image/gif;base64,R0lGODlhAQABAIAAAP///////yH5BAEKAAEALAAAAAABAAEAAAICTAEAOw=="
38,Waymo’s Autonomous Cars Cut Out Human Drivers in Road Tests,The New York Times,"Nov 7, 2017",2017-11-07 00:00:00.000000,"Waymo's Autonomous Cars Cut Out Human Drivers in Road Tests ... Waymo&rsquo;s driverless cars at a media event in June in Chandler, Ariz. Waymo's driverless cars ...",https://www.nytimes.com/2017/11/07/technology/waymo-autonomous-cars.html,"data:image/gif;base64,R0lGODlhAQABAIAAAP///////yH5BAEKAAEALAAAAAABAAEAAAICTAEAOw=="
39,U.S. Proposes Spending $4 Billion on Self-Driving Cars,The New York Times,"Jan 14, 2016",2016-01-14 00:00:00.000000,Foxx said that autonomous vehicles had the potential to reduce traffic accidents and significantly improve safety on America's roads. He estimated that as many ...,https://www.nytimes.com/2016/01/15/business/us-proposes-spending-4-billion-on-self-driving-cars.html,"data:image/gif;base64,R0lGODlhAQABAIAAAP///////yH5BAEKAAEALAAAAAABAAEAAAICTAEAOw=="
40,Ghost Ride: The First Fully Autonomous Car Ride Took Place ...,KUT.org,"Dec 13, 2016",2016-12-13 00:00:00.000000,"Today, Google's parent company Alphabet announced its intention to bring driverless cars to the open market in a new endeavor called Waymo – a project that, ...",https://www.kut.org/science/2016-12-13/ghost-ride-the-first-fully-autonomous-car-ride-took-place-in-austin-over-a-year-ago,"data:image/gif;base64,R0lGODlhAQABAIAAAP///////yH5BAEKAAEALAAAAAABAAEAAAICTAEAOw=="
41,Google has reportedly stopped developing its own self-driving car,TechCrunch,"Dec 13, 2016",2016-12-13 00:00:00.000000,Google has reportedly shelved its long-standing plan to develop its own autonomous vehicle in favor of pursuing partnerships with existing car makers.,https://techcrunch.com/2016/12/12/google-has-reportedly-stopped-developing-its-own-self-driving-car/,"data:image/gif;base64,R0lGODlhAQABAIAAAP///////yH5BAEKAAEALAAAAAABAAEAAAICTAEAOw=="
42,Blind man sets out alone in Google's driverless car,The Washington Post,"Dec 13, 2016",2016-12-13 00:00:00.000000,"Steve Mahan, who is legally blind, was the first non-Google employee to ride alone in the company's gumdrop-shaped autonomous car. “It is like driving with a ...",https://www.washingtonpost.com/local/trafficandcommuting/blind-man-sets-out-alone-in-googles-driverless-car/2016/12/13/f523ef42-c13d-11e6-8422-eac61c0ef74d_story.html,"data:image/gif;base64,R0lGODlhAQABAIAAAP///////yH5BAEKAAEALAAAAAABAAEAAAICTAEAOw=="
43,Driverless cars set to roll out for trials on UK roads,The Guardian,"Feb 10, 2015",2015-02-10 00:00:00.000000,The prototype driverless cars to be tested in the heart of four British ... An autonomous shuttle traversing the North Greenwich plaza beside O₂ Arena will ...,https://www.theguardian.com/technology/2015/feb/11/driverless-cars-roll-out-trials-uk-roads,"data:image/gif;base64,R0lGODlhAQABAIAAAP///////yH5BAEKAAEALAAAAAABAAEAAAICTAEAOw=="
44,Hyundai and Apple May Partner on Autonomous Apple Car Project,Car and Driver,"Jan 8, 2021",2021-01-08 00:00:00.000000,"Hyundai is reportedly in talks to partner with Apple to build an autonomous electric vehicle, a project currently known as the Apple Car, according to the ...",https://www.caranddriver.com/news/a35162835/hyundai-apple-autonomous-car-talks/,"data:image/gif;base64,R0lGODlhAQABAIAAAP///////yH5BAEKAAEALAAAAAABAAEAAAICTAEAOw=="
45,Driverless Cars Will Face Moral Dilemmas,Scientific American,"Jun 23, 2016",2016-06-23 00:00:00.000000,Autonomous vehicles may put people in life-or-death situations. Will the outcomes be decided by ethics or data? ... A self-driving car carrying a family of four ...,https://www.scientificamerican.com/article/driverless-cars-will-face-moral-dilemmas/,"data:image/gif;base64,R0lGODlhAQABAIAAAP///////yH5BAEKAAEALAAAAAABAAEAAAICTAEAOw=="
46,"Cruise sends driverless cars out, releases video of it to the public",Detroit Free Press,"Dec 9, 2020",2020-12-09 00:00:00.000000,"In October, the California Department of Motor Vehicles gave Cruise permission to test its autonomous vehicles without a safety driver in San Francisco.",https://www.freep.com/story/money/cars/general-motors/2020/12/09/cruise-gm-driverless-san-francisco-video/3863317001/,"data:image/gif;base64,R0lGODlhAQABAIAAAP///////yH5BAEKAAEALAAAAAABAAEAAAICTAEAOw=="
47,"You May Not Have Heard, But The Autonomous Vehicle Has Now Arrived",Forbes,"Oct 11, 2020",2020-10-11 00:00:00.000000,When I began writing regularly about autonomous driving in 2012 (Google's ... Whether you have autonomous vehicles in your city depends on the concerns of ...,https://www.forbes.com/sites/enriquedans/2020/10/11/you-may-not-have-heard-but-the-autonomous-vehicle-has-nowarrived/,"data:image/gif;base64,R0lGODlhAQABAIAAAP///////yH5BAEKAAEALAAAAAABAAEAAAICTAEAOw=="
48,"Driverless Cars Won’t Prevent Most Accidents, Insurance Institute Study Finds",Forbes,"Jun 5, 2020",2020-06-05 00:00:00.000000,"The benefits of autonomous vehicles received another caveat Thursday, when the Insurance Institute for Highway Safety warned that the technology likely will ...",https://www.forbes.com/sites/greggardner/2020/06/05/driverless-cars-wont-prevent-most-accidents-insurance-institute-study-finds/,"data:image/gif;base64,R0lGODlhAQABAIAAAP///////yH5BAEKAAEALAAAAAABAAEAAAICTAEAOw=="
49,"Google's robotic, driverless cars may be futuristic, but they're not the droids we're looking for",The Conversation,"May 30, 2014",2014-05-30 00:00:00.000000,Footage of Google's prototype driverless car has got people talking about the potential for self-driving vehicles. While this seems like an exciting new ...,https://theconversation.com/googles-robotic-driverless-cars-may-be-futuristic-but-theyre-not-the-droids-were-looking-for-27399,"data:image/gif;base64,R0lGODlhAQABAIAAAP///////yH5BAEKAAEALAAAAAABAAEAAAICTAEAOw=="
50,Ford is bringing its self-driving cars to Miami,The Verge,"Feb 27, 2018",2018-02-27 00:00:00.000000,"Initially, Ford will test two types of autonomous cars in Miami: the aforementioned blue-and-white research vehicles with hardware and software technology ...",https://www.theverge.com/2018/2/27/17055616/ford-self-driving-car-miami-test-av,"data:image/gif;base64,R0lGODlhAQABAIAAAP///////yH5BAEKAAEALAAAAAABAAEAAAICTAEAOw=="
51,Uber’s Driverless Cars Return to the Road After Fatal Crash,The New York Times,"Dec 20, 2018",2018-12-20 00:00:00.000000,"SAN FRANCISCO — Uber said its autonomous vehicles returned to public roads on Thursday, nine months after one of its self-driving cars killed a pedestrian ...",https://www.nytimes.com/2018/12/20/technology/uber-driverless-cars-return.html,"data:image/gif;base64,R0lGODlhAQABAIAAAP///////yH5BAEKAAEALAAAAAABAAEAAAICTAEAOw=="
52,GM's Cruise plans to test unmanned self-driving cars this year in San Francisco,CNBC,"Oct 15, 2020",2020-10-15 00:00:00.000000,"Cruise, a majority-owned subsidiary of GM, plans to begin testing unmanned autonomous vehicles by the end of this year in San Francisco.",https://www.cnbc.com/2020/10/15/gm-cruise-to-begin-testing-unmanned-autonomous-vehicles-this-year.html,"data:image/gif;base64,R0lGODlhAQABAIAAAP///////yH5BAEKAAEALAAAAAABAAEAAAICTAEAOw=="
53,"Self-Driving Cars Could Change the Auto Industry (GM, F)",Investopedia,"Mar 25, 2017",2017-03-25 00:00:00.000000,"A true driverless car, however, has remained elusive until recently. In the 1960s an autonomous vehicle was developed as a possible moon rover for the Apollo ...",https://www.investopedia.com/articles/personal-finance/031315/selfdriving-cars-could-change-auto-industry.asp,"data:image/gif;base64,R0lGODlhAQABAIAAAP///////yH5BAEKAAEALAAAAAABAAEAAAICTAEAOw=="
54,Autonomous Vehicles Makers Report Disengagement Numbers in California,WIRED,"Feb 1, 2017",2017-02-01 00:00:00.000000,"Google and General Motors are leading the class with cars capable of driving ... Ford's two autonomous cars in California only drive on the highway, ...",https://www.wired.com/2017/02/california-dmv-autonomous-car-disengagement/,"data:image/gif;base64,R0lGODlhAQABAIAAAP///////yH5BAEKAAEALAAAAAABAAEAAAICTAEAOw=="
