,title,media,date,datetime,desc,link,img
112,Domino’s will start delivering pizzas via an autonomous robot this fall,The Washington Post,"Jun 17, 2019",2019-06-17 00:00:00.000000,"“Nuro's vehicles are specially designed to optimize the food delivery experience, which makes them a valuable partner in our autonomous vehicle journey."".",https://www.washingtonpost.com/technology/2019/06/17/dominos-will-start-delivering-pizzas-via-an-autonomous-robot-this-fall/,"data:image/gif;base64,R0lGODlhAQABAIAAAP///////yH5BAEKAAEALAAAAAABAAEAAAICTAEAOw=="
113,Self-Driving Cars Could Cut 90% of Accidents,The Wall Street Journal,"Mar 5, 2015",2015-03-05 00:00:00.000000,Their promise has become a central theme in an industry scrambling to improve vehicle safety and revolutionize the core of an automobile. “Autonomous vehicles ...,https://www.wsj.com/articles/self-driving-cars-could-cut-down-on-accidents-study-says-1425567905,"data:image/gif;base64,R0lGODlhAQABAIAAAP///////yH5BAEKAAEALAAAAAABAAEAAAICTAEAOw=="
114,"Keen to develop self-driving cars, Hyundai Motor Group unveils $35 billion investment plan",Reuters,"Oct 15, 2019",2019-10-15 00:00:00.000000,"South Korea's government is also onboard, unveiling more funding for autonomous vehicle technology with President Moon Jae-in declaring on Tuesday that he ...",https://www.reuters.com/article/us-southkorea-hyundai-motor-idUSKBN1WU0QG,"data:image/gif;base64,R0lGODlhAQABAIAAAP///////yH5BAEKAAEALAAAAAABAAEAAAICTAEAOw=="
115,Lyft Wants People to Be Hailing Fully Driverless Cars on Its ...,Bloomberg.com,"Dec 16, 2020",2020-12-16 00:00:00.000000,"Lyft Inc. expects customers will be able to use its app to hail cars without drivers starting in 2023, the company said Wednesday. The self-driving rides ...",https://www.bloomberg.com/news/articles/2020-12-16/lyft-wants-people-to-be-hailing-fully-driverless-cars-on-its-app-by-2023,"data:image/gif;base64,R0lGODlhAQABAIAAAP///////yH5BAEKAAEALAAAAAABAAEAAAICTAEAOw=="
116,"Apple just dismissed more than 200 employees from Project Titan, its autonomous vehicle group",CNBC,"Jan 24, 2019",2019-01-24 00:00:00.000000,"Apple just dismissed more than 200 employees from Project Titan, its autonomous vehicle group. Published Thu, Jan 24 20191:06 AM EST Updated Thu, ...",https://www.cnbc.com/2019/01/24/apple-lays-off-over-200-from-project-titan-autonomous-vehicle-group.html,"data:image/gif;base64,R0lGODlhAQABAIAAAP///////yH5BAEKAAEALAAAAAABAAEAAAICTAEAOw=="
117,Apple’s self-driving car strategy may be stuck in neutral,VentureBeat,"Feb 9, 2021",2021-02-09 00:00:00.000000,It will have a conflict of interest with a flourishing Apple Car that would undermine its own plans for becoming a leader in electric and autonomous vehicles.,https://venturebeat.com/2021/02/09/apples-self-driving-car-strategy-may-be-stuck-in-neutral/,"data:image/gif;base64,R0lGODlhAQABAIAAAP///////yH5BAEKAAEALAAAAAABAAEAAAICTAEAOw=="
118,Honda launches world's first level 3 self-driving car,Nikkei Asia,"Mar 4, 2021",2021-03-04 00:00:00.000000,"TOKYO -- Honda Motor will on Friday launch a new car equipped with the world's first certified level 3 autonomous driving technology, paving the way for the ...",https://asia.nikkei.com/Business/Automobiles/Honda-launches-world-s-first-level-3-self-driving-car,"data:image/gif;base64,R0lGODlhAQABAIAAAP///////yH5BAEKAAEALAAAAAABAAEAAAICTAEAOw=="
119,Autonomous vehicles could cost America 5 million jobs. What should we do about it?,Los Angeles Times,"Sep 22, 2016",2016-09-22 00:00:00.000000,"Adding to the momentum, Ford and BMW say they will produce autonomous cars by 2021. Driverless cars will create some big winners — imagine how Uber's and Lyft's ...",https://www.latimes.com/opinion/op-ed/la-oe-greenhouse-driverless-job-loss-20160922-snap-story.html,"data:image/gif;base64,R0lGODlhAQABAIAAAP///////yH5BAEKAAEALAAAAAABAAEAAAICTAEAOw=="
120,Apple Self-Driving Cars Tests More Than Doubled in 2020,Bloomberg.com,"Feb 9, 2021",2021-02-09 00:00:00.000000,"more than doubled road testing of its self-driving cars in 2020 as its autonomous technology improved, though it still significantly lags behind rivals as it ...",https://www.bloomberg.com/news/articles/2021-02-09/apple-more-than-doubled-road-tests-of-autonomous-cars-in-2020,"data:image/gif;base64,R0lGODlhAQABAIAAAP///////yH5BAEKAAEALAAAAAABAAEAAAICTAEAOw=="
121,China lays out self-driving rules in global race: China Daily,Reuters,"Apr 12, 2018",2018-04-12 00:00:00.000000,SHANGHAI (Reuters) - China has laid out national guidelines for testing self-driving cars as it looks to keep pace with the United States in a global race ...,https://www.reuters.com/article/us-autos-selfdriving-china-idUSKBN1HK04J,"data:image/gif;base64,R0lGODlhAQABAIAAAP///////yH5BAEKAAEALAAAAAABAAEAAAICTAEAOw=="
122,Autonomous cars without human 'backup drivers' are coming ...,Curbed,"Feb 27, 2018",2018-02-27 00:00:00.000000,About 50 companies have licenses to operate driverless cars in the state but until now the DMV has required that a human be in the front seat of the vehicle and ...,https://archive.curbed.com/2018/2/27/17056958/driverless-cars-california-waymo-uber,"data:image/gif;base64,R0lGODlhAQABAIAAAP///////yH5BAEKAAEALAAAAAABAAEAAAICTAEAOw=="
123,How Jaywalking Could Jam Up the Era of Self-Driving Cars,The New York Times,"Aug 1, 2019",2019-08-01 00:00:00.000000,"Autonomous vehicles are classified by six levels, from zero to five. Fully autonomous, Level 5, vehicles will not be available for 10 years or longer, Mr.",https://www.nytimes.com/2019/08/01/business/self-driving-cars-jaywalking.html,"data:image/gif;base64,R0lGODlhAQABAIAAAP///////yH5BAEKAAEALAAAAAABAAEAAAICTAEAOw=="
124,"Dispatch From The Future: Uber To Purchase 2,500 Driverless Cars From Google",TechCrunch,"Aug 26, 2013",2013-08-26 00:00:00.000000,"Uber has committed to invest up to $375 million for a fleet of Google's GX3200 vehicles, which are the company's third generation of autonomous driving cars ...",https://techcrunch.com/2013/08/25/uberauto/,"data:image/gif;base64,R0lGODlhAQABAIAAAP///////yH5BAEKAAEALAAAAAABAAEAAAICTAEAOw=="
125,Self-Driving Cars Raise Questions About Who Carries Insurance,NPR,"Apr 3, 2017",2017-04-03 00:00:00.000000,"A driverless car changes that model, shifting the insurance toward automakers, and away from drivers or car owners. It won't be a complete or immediate shift.",https://www.npr.org/sections/alltechconsidered/2017/04/03/522222975/self-driving-cars-raise-questions-about-who-carries-insurance,"data:image/gif;base64,R0lGODlhAQABAIAAAP///////yH5BAEKAAEALAAAAAABAAEAAAICTAEAOw=="
126,Google Lobbies Nevada to Allow Self-Driving Cars (Published ...,The New York Times,"May 10, 2011",2011-05-10 00:00:00.000000,"One is an amendment to an electric-vehicle bill providing for the licensing and testing of autonomous vehicles, and the other is the exemption that would permit ...",https://www.nytimes.com/2011/05/11/science/11drive.html,"data:image/gif;base64,R0lGODlhAQABAIAAAP///////yH5BAEKAAEALAAAAAABAAEAAAICTAEAOw=="
127,"Toyota, Autonomous Vehicle Startup Aurora Enter Self-Driving ...",Bloomberg.com,"Feb 9, 2021",2021-02-09 00:00:00.000000,... has agreed to a long-term strategic partnership with Toyota Motor Corp. and its supplier Denso Corp. that aims to mass produce autonomous vehicles and ...,https://www.bloomberg.com/news/articles/2021-02-09/toyota-autonomous-vehicle-startup-aurora-enter-self-driving-cars-partnership,"data:image/gif;base64,R0lGODlhAQABAIAAAP///////yH5BAEKAAEALAAAAAABAAEAAAICTAEAOw=="
128,7 Ideas To Pave The Way For Autonomous Vehicles,Forbes,"Apr 9, 2018",2018-04-09 00:00:00.000000,"As more autonomous vehicles have taken to the roads, transportation expert Ben Pierce has been noticing ways the roads should prepare for them.",https://www.forbes.com/sites/jeffmcmahon/2018/04/09/7-ways-the-roads-can-get-ready-for-autonomous-vehicles/,"data:image/gif;base64,R0lGODlhAQABAIAAAP///////yH5BAEKAAEALAAAAAABAAEAAAICTAEAOw=="
129,Kroger Is Using Unmanned Autonomous Vehicles To Deliver Groceries In Arizona,Forbes,"Dec 19, 2018",2018-12-19 00:00:00.000000,"Kroger is using unmanned autonomous vehicles to deliver groceries in Scottsdale, Arizona. The company has a partnership with Nuro, a Silicon Valley startup ...",https://www.forbes.com/sites/lanabandoim/2018/12/19/kroger-is-using-unmanned-autonomous-vehicles-to-deliver-groceries-in-arizona/,"data:image/gif;base64,R0lGODlhAQABAIAAAP///////yH5BAEKAAEALAAAAAABAAEAAAICTAEAOw=="
130,Can Detroit Beat Google to the Self-Driving Car?,Bloomberg.com,"Oct 29, 2015",2015-10-29 00:00:00.000000,"“I like to drive cars,” says Mark Reuss, product development chief at General Motors, “so this is a little funny.” Not funny-ha-ha, Reuss clarifies, ...",https://www.bloomberg.com/features/2015-gm-super-cruise-driverless-car/,"data:image/gif;base64,R0lGODlhAQABAIAAAP///////yH5BAEKAAEALAAAAAABAAEAAAICTAEAOw=="
131,Motional is now testing fully autonomous vehicles in Las Vegas,The Verge,"Feb 22, 2021",2021-02-22 00:00:00.000000,Add Motional to the very short list of companies that have tested fully autonomous vehicles on public roads. The Hyundai-Aptiv joint venture announced that ...,https://www.theverge.com/2021/2/22/22291682/motional-fully-driverless-autonomous-cars-las-vegas,"data:image/gif;base64,R0lGODlhAQABAIAAAP///////yH5BAEKAAEALAAAAAABAAEAAAICTAEAOw=="
132,Elon Musk Says Tesla Vehicles Will Drive Themselves in Two Years,Fortune,"Dec 21, 2015",2015-12-21 00:00:00.000000,"Producing a fully autonomous vehicle that can operate in any condition and on any road, for example, is easy-ish. And Tesla Motors (TSLA), the all-electric ...",https://fortune.com/2015/12/21/elon-musk-interview/,"data:image/gif;base64,R0lGODlhAQABAIAAAP///////yH5BAEKAAEALAAAAAABAAEAAAICTAEAOw=="
133,"Self-Driving Cars Are Coming, But Are We Ready For Them?",NPR,"Jan 11, 2016",2016-01-11 00:00:00.000000,"Companies like Google, Uber, Tesla, Ford, Lyft, Toyota, BMW and General Motors are striking partnerships and making plans to equip our cars with more autonomous ...",https://www.npr.org/sections/alltechconsidered/2016/01/11/462694123/self-driving-cars-are-coming-but-are-we-ready-for-them,"data:image/gif;base64,R0lGODlhAQABAIAAAP///////yH5BAEKAAEALAAAAAABAAEAAAICTAEAOw=="
134,Edmunds: Where are our self-driving cars?,ABC News,"Nov 4, 2020",2020-11-04 00:00:00.000000,"Well, it's been a few years and autonomous vehicles are, alas, still in the future. Right now, there is no car on sale that can drive itself without ...",https://abcnews.go.com/Lifestyle/wireStory/edmunds-driving-cars-74017111,"data:image/gif;base64,R0lGODlhAQABAIAAAP///////yH5BAEKAAEALAAAAAABAAEAAAICTAEAOw=="
135,Oxbotica raises $47M to deploy its autonomous vehicle software in industrial applications,TechCrunch,"Jan 6, 2021",2021-01-06 00:00:00.000000,"While the world continues to await the arrival of safe, reliable and cost-effective self-driving cars, one of the pioneers in the world of autonomous ...",https://techcrunch.com/2021/01/05/oxbotica-raises-47m-to-deploy-its-autonomous-vehicle-software-in-industrial-applications/,"data:image/gif;base64,R0lGODlhAQABAIAAAP///////yH5BAEKAAEALAAAAAABAAEAAAICTAEAOw=="
136,Uber Goes to Washington. Autonomous Cars with Humans to Collect Data in D.C.,Insurance Journal,"Jan 24, 2020",2020-01-24 00:00:00.000000,Uber is operating self-driving cars in autonomous mode in Pittsburgh with safety drivers behind the wheel but only during daylight hours.,https://www.insurancejournal.com/news/east/2020/01/24/556308.htm,"data:image/gif;base64,R0lGODlhAQABAIAAAP///////yH5BAEKAAEALAAAAAABAAEAAAICTAEAOw=="
137,Who's Winning the Self-Driving Car Race?,Bloomberg.com,"May 7, 2018",2018-05-07 00:00:00.000000,"and a couple of other players, by at least a year to introduce driverless cars to the public. A deal reached in January to buy thousands of additional Chrysler ...",https://www.bloomberg.com/news/features/2018-05-07/who-s-winning-the-self-driving-car-race,"data:image/gif;base64,R0lGODlhAQABAIAAAP///////yH5BAEKAAEALAAAAAABAAEAAAICTAEAOw=="
138,WATCH: Self-Driving Cars Need To Learn How Humans Drive,NPR,"Aug 21, 2018",2018-08-21 00:00:00.000000,"Waymo, formerly the Google self-driving-car project, says that its self-driving cars have already driven millions of miles on the open road. Stanford University ...",https://www.npr.org/2018/08/21/639646651/watch-self-driving-cars-need-to-learn-how-humans-drive,"data:image/gif;base64,R0lGODlhAQABAIAAAP///////yH5BAEKAAEALAAAAAABAAEAAAICTAEAOw=="
139,"Self-Driving Cars Could Ease Our Commutes, But That'll Take ...",NPR,"Feb 10, 2017",2017-02-10 00:00:00.000000,The promise of automated cars is that they could eliminate human-error accidents and potentially enable more efficient use of roadways.,https://www.npr.org/sections/alltechconsidered/2017/02/10/514091049/self-driving-cars-could-ease-our-commutes-but-thatll-take-a-while,"data:image/gif;base64,R0lGODlhAQABAIAAAP///////yH5BAEKAAEALAAAAAABAAEAAAICTAEAOw=="
140,Uber expects a long wait before self-driving cars dominate,VentureBeat,"Apr 8, 2019",2019-04-08 00:00:00.000000,"The more cautious tone marks a change from three years ago, when Uber embraced aggressive tactics to turbocharge its autonomous vehicle development in a bid ...",https://venturebeat.com/2019/04/08/uber-expects-a-long-wait-before-self-driving-cars-dominate/,"data:image/gif;base64,R0lGODlhAQABAIAAAP///////yH5BAEKAAEALAAAAAABAAEAAAICTAEAOw=="
141,Uber’s Self-Driving Cars Are Set to Return in a Downsized Test,The New York Times,"Dec 5, 2018",2018-12-05 00:00:00.000000,Uber was driving its autonomous vehicles on public roads in four cities — sometimes at night — at speeds as high as 55 miles an hour when testing was halted ...,https://www.nytimes.com/2018/12/05/technology/uber-self-driving-cars.html,"data:image/gif;base64,R0lGODlhAQABAIAAAP///////yH5BAEKAAEALAAAAAABAAEAAAICTAEAOw=="
142,Self-driving cars are coming – but are we ready?,The Conversation,"Jul 26, 2017",2017-07-26 00:00:00.000000,"The number of highly automated cars as a share of everything on the road will grow over time, but only relatively slowly. A self-driving Uber car on the road in ...",https://theconversation.com/self-driving-cars-are-coming-but-are-we-ready-81538,"data:image/gif;base64,R0lGODlhAQABAIAAAP///////yH5BAEKAAEALAAAAAABAAEAAAICTAEAOw=="
143,Some Easy Things We Could Do to Make All Autonomous ...,Electronic Frontier Foundation,"Mar 29, 2018",2018-03-29 00:00:00.000000,"More than a week after an Uber vehicle driving in autonomous mode killed a pedestrian in Tempe, Arizona — the first pedestrian death by a self-driving car ...",https://www.eff.org/deeplinks/2018/03/some-easy-things-we-could-do-make-all-autonomous-cars-safer-faster,"data:image/gif;base64,R0lGODlhAQABAIAAAP///////yH5BAEKAAEALAAAAAABAAEAAAICTAEAOw=="
144,Volvo to test self-driving cars on London's roads next year,The Guardian,"Apr 26, 2016",2016-04-26 00:00:00.000000,Swedish carmaker plans to run driverless vehicles on public roads starting with small number of semi-autonomous cars in 2017. A woman in Volvo's driverless ...,https://www.theguardian.com/technology/2016/apr/27/volvo-test-self-driving-cars-london-2017,"data:image/gif;base64,R0lGODlhAQABAIAAAP///////yH5BAEKAAEALAAAAAABAAEAAAICTAEAOw=="
145,Toyota's not alone in the slow lane to self-driving cars,Reuters,"Oct 25, 2019",2019-10-25 00:00:00.000000,"At the moment, its cars are able to drive on highways and park autonomously. To develop the more advanced “Level 3” hands-free automated driving technology, ...",https://www.reuters.com/article/us-autoshow-tokyo-toyota-technology-idUSKBN1X41XF,"data:image/gif;base64,R0lGODlhAQABAIAAAP///////yH5BAEKAAEALAAAAAABAAEAAAICTAEAOw=="
146,Uber shuts down self-driving operation in Arizona after fatal crash,The Guardian,"May 23, 2018",2018-05-23 00:00:00.000000,Uber is to shut down its self-driving car programme in Arizona after one of its ... Meyhofer said that returning to testing driverless cars to public roads ...,https://www.theguardian.com/technology/2018/may/23/uber-shuts-down-self-driving-operation-in-arizona-two-months-after-fatal-crash,"data:image/gif;base64,R0lGODlhAQABAIAAAP///////yH5BAEKAAEALAAAAAABAAEAAAICTAEAOw=="
147,"Women Say No Thanks to Driverless Cars, Survey Finds; Men ...",NerdWallet,"Jun 9, 2015",2015-06-09 00:00:00.000000,"Self-driving cars, also known as autonomous vehicles, once seemed the stuff of science fiction, but they are already testing on the highway and seem certain to ...",https://www.nerdwallet.com/blog/insurance/auto/survey-consumer-fears-self-driving-cars/,"data:image/gif;base64,R0lGODlhAQABAIAAAP///////yH5BAEKAAEALAAAAAABAAEAAAICTAEAOw=="
148,Volvo CEO: We will accept all liability when our cars are in autonomous mode,Fortune,"Oct 7, 2015",2015-10-07 00:00:00.000000,Volvo Car Group President and CEO Håkan Samuelsson said Thursday that the company will accept full liability whenever one of its cars is in autonomous mode.,https://fortune.com/2015/10/07/volvo-liability-self-driving-cars/,"data:image/gif;base64,R0lGODlhAQABAIAAAP///////yH5BAEKAAEALAAAAAABAAEAAAICTAEAOw=="
149,Ford wants to be the self-driving OS for the future of transportation,The Verge,"Jan 9, 2018",2018-01-09 00:00:00.000000,"... and reap the benefits of the auto giant's fleet of autonomous vehicles. ... By 2019, Ford says all of its new cars will hit the road with Qualcomm's ...",https://www.theverge.com/2018/1/9/16868814/ford-self-driving-autonomous-vehicle-ces-2018,"data:image/gif;base64,R0lGODlhAQABAIAAAP///////yH5BAEKAAEALAAAAAABAAEAAAICTAEAOw=="
150,Amazon invests in self-driving vehicle startup Aurora,CNN,"Feb 7, 2019",2019-02-07 00:00:00.000000,"The tech giant announced an investment in Aurora, a highly regarded Silicon Valley startup that develops technology to power fully autonomous vehicles.",https://www.cnn.com/2019/02/07/tech/amazon-autonomous-vehicles/index.html,"data:image/gif;base64,R0lGODlhAQABAIAAAP///////yH5BAEKAAEALAAAAAABAAEAAAICTAEAOw=="
151,White Paper: These 12 Principles Are Shaping the Future of Autonomous Cars,Futurism,"Jul 3, 2019",2019-07-03 00:00:00.000000,Safe Operation: An autonomous vehicle must be able to cope with the loss of any of its critical components. Safety Layer: The self-driving car must know its own ...,https://futurism.com/12-principles-shape-safe-autonomous-vehicles,"data:image/gif;base64,R0lGODlhAQABAIAAAP///////yH5BAEKAAEALAAAAAABAAEAAAICTAEAOw=="
152,People must retain control of autonomous vehicles,Nature,"Apr 6, 2018",2018-04-06 00:00:00.000000,"The safety and efficiency benefits of autonomous cars rely on computers making better, quicker decisions than people. Users input their desired destination and ...",https://www.nature.com/articles/d41586-018-04158-5,"data:image/gif;base64,R0lGODlhAQABAIAAAP///////yH5BAEKAAEALAAAAAABAAEAAAICTAEAOw=="
153,"Nissan completes UK's longest, most complex driverless car trip",Reuters,"Feb 5, 2020",2020-02-05 00:00:00.000000,"CRANFIELD, England (Reuters) - A Nissan car has completed a 230-mile journey ... Britain has been wooing developers of autonomous vehicles, hoping to grab a ...",https://www.reuters.com/article/us-nissan-autonomous-britain-idUSKBN1ZZ11Z,"data:image/gif;base64,R0lGODlhAQABAIAAAP///////yH5BAEKAAEALAAAAAABAAEAAAICTAEAOw=="
154,Who is to blame for 'self-driving car' deaths?,BBC,"May 22, 2018",2018-05-22 00:00:00.000000,The confusion between fully autonomous self-driving cars and those that simply offer driver assistance technologies is leading to deaths on the road.,https://www.bbc.com/news/business-44159581,"data:image/gif;base64,R0lGODlhAQABAIAAAP///////yH5BAEKAAEALAAAAAABAAEAAAICTAEAOw=="
155,"Are 175 Million Americans Right About Driverless Cars? Remarkably, Yes",Forbes,"May 3, 2019",2019-05-03 00:00:00.000000,The tryouts on our roadways today tend to involve semi-autonomous cars that require a licensed human driver to co-share the driving task. For those less-than ...,https://www.forbes.com/sites/lanceeliot/2019/05/03/are-175-million-americans-right-about-driverless-cars-remarkably-yes/,"data:image/gif;base64,R0lGODlhAQABAIAAAP///////yH5BAEKAAEALAAAAAABAAEAAAICTAEAOw=="
156,"Apple, Spurned by Others, Signs Deal With Volkswagen for Driverless Cars",The New York Times,"May 23, 2018",2018-05-23 00:00:00.000000,"Apple, Spurned by Others, Signs Deal With Volkswagen for Driverless Cars ... for self-driving cars and then by working solely on an autonomous shuttle for ...",https://www.nytimes.com/2018/05/23/technology/apple-bmw-mercedes-volkswagen-driverless-cars.html,"data:image/gif;base64,R0lGODlhAQABAIAAAP///////yH5BAEKAAEALAAAAAABAAEAAAICTAEAOw=="
157,"Qualcomm launches autonomous driving computer, aiming to hit roads by 2023",Reuters,"Jan 6, 2020",2020-01-06 00:00:00.000000,O on Monday announced a computing system for autonomous vehicles designed to ... is the company's first foray into a full system to power self-driving cars.,https://www.reuters.com/article/us-tech-ces-qualcomm-idUSKBN1Z51YH,"data:image/gif;base64,R0lGODlhAQABAIAAAP///////yH5BAEKAAEALAAAAAABAAEAAAICTAEAOw=="
158,Waymo raises $2.25 billion to scale up autonomous vehicles operations,VentureBeat,"Mar 2, 2020",2020-03-02 00:00:00.000000,"Waymo, Google parent company Alphabet's autonomous vehicles division, just got a massive capital infusion from a coterie of investors.",https://venturebeat.com/2020/03/02/waymo-raises-2-25-billion-to-scale-up-autonomous-vehicles-operations/,"data:image/gif;base64,R0lGODlhAQABAIAAAP///////yH5BAEKAAEALAAAAAABAAEAAAICTAEAOw=="
159,Uber’s first self-driving car spotted in Pittsburgh,The Guardian,"May 22, 2015",2015-05-22 00:00:00.000000,"A car fitted with cameras and laser scanners has been seen driving on public roads in the US, as Uber's research centre starts testing technology. uber app.",https://www.theguardian.com/technology/2015/may/22/uber-self-driving-car-pittsburgh,"data:image/gif;base64,R0lGODlhAQABAIAAAP///////yH5BAEKAAEALAAAAAABAAEAAAICTAEAOw=="
160,Toyota's Semi-Autonomous Cars Hit the Real Road,Popular Mechanics,"Oct 10, 2013",2013-10-10 00:00:00.000000,"Motor vehicle, Automotive mirror, Mode of transport, Automotive design, Road, Daytime. Autonomous driving is no longer a question of if; self ...",https://www.popularmechanics.com/cars/a9588/toyotas-semi-autonomous-cars-hit-the-real-road-16024804/,"data:image/gif;base64,R0lGODlhAQABAIAAAP///////yH5BAEKAAEALAAAAAABAAEAAAICTAEAOw=="
161,Tim Cook drops hints about autonomous tech and the Apple car,TechCrunch,"Apr 5, 2021",2021-04-05 00:00:00.000000,"“The autonomy itself is a core technology, in my view,” Cook told Kara Swisher in an interview on the “Sway” podcast. “If you sort of step back, the car, in a ...",https://techcrunch.com/2021/04/05/tim-cook-drops-hints-about-autonomous-tech-and-the-apple-car/,"data:image/gif;base64,R0lGODlhAQABAIAAAP///////yH5BAEKAAEALAAAAAABAAEAAAICTAEAOw=="
162,When will self-driving cars take over?,The Week,"Nov 17, 2018",2018-11-17 00:00:00.000000,"The driverless-car revolution is way behind schedule. ... Carmakers have been claiming that autonomous vehicles, or AVs, will start filling the roads by ...",https://theweek.com/articles/807864/when-selfdriving-cars-take-over,"data:image/gif;base64,R0lGODlhAQABAIAAAP///////yH5BAEKAAEALAAAAAABAAEAAAICTAEAOw=="
163,GM Buying Self-Driving Tech Startup for More Than $1 Billion,Fortune,"Mar 11, 2016",2016-03-11 00:00:00.000000,"General Motors (GM) this morning announced that it will acquire Cruise Automation, a San Francisco-based developer of autonomous vehicle technology.",https://fortune.com/2016/03/11/gm-buying-self-driving-tech-startup-for-more-than-1-billion/,"data:image/gif;base64,R0lGODlhAQABAIAAAP///////yH5BAEKAAEALAAAAAABAAEAAAICTAEAOw=="
164,When Driverless Cars Break the Law,The New York Times,"May 13, 2014",2014-05-13 00:00:00.000000,"Carmakers like BMW and Toyota are also preparing to sell cars that drive themselves. Instead, the bigger question about driverless cars is a legal one. Who is ...",https://www.nytimes.com/2014/05/14/upshot/when-driverless-cars-break-the-law.html,"data:image/gif;base64,R0lGODlhAQABAIAAAP///////yH5BAEKAAEALAAAAAABAAEAAAICTAEAOw=="
165,Self-driving robotaxis are taking off in China,CNN,"Dec 8, 2020",2020-12-08 00:00:00.000000,"Hong Kong (CNN Business) The world has been inching toward fully autonomous cars for years. In China, one company just got even closer to making it a ...",https://www.cnn.com/2020/12/03/tech/autox-robotaxi-china-intl-hnk/index.html,"data:image/gif;base64,R0lGODlhAQABAIAAAP///////yH5BAEKAAEALAAAAAABAAEAAAICTAEAOw=="
166,Where's the lane? Self-driving cars confused by shabby U.S. roadways,Reuters,"Mar 31, 2016",2016-03-31 00:00:00.000000,"Tesla CEO Elon Musk recently called the mundane issue of faded lane markings “crazy,” complaining they confused his semi-autonomous cars.",https://www.reuters.com/article/us-autos-autonomous-infrastructure-insig-idUSKCN0WX131,"data:image/gif;base64,R0lGODlhAQABAIAAAP///////yH5BAEKAAEALAAAAAABAAEAAAICTAEAOw=="
167,Ford postpones autonomous vehicle service until 2022,TechCrunch,"Apr 28, 2020",2020-04-28 00:00:00.000000,"Ford said Tuesday it will delay until 2022 plans to launch an autonomous vehicle service, as the COVID-19 pandemic has prompted the company to rethink its ...",https://techcrunch.com/2020/04/28/ford-postpones-autonomous-vehicle-service-until-2022/,"data:image/gif;base64,R0lGODlhAQABAIAAAP///////yH5BAEKAAEALAAAAAABAAEAAAICTAEAOw=="
168,"Volvo Cars to supply Uber with up to 24,000 self-driving cars",Reuters,"Nov 20, 2017",2017-11-20 00:00:00.000000,"Should Uber buy all 24,000 cars, it would be Volvo's largest order by far and the biggest sale in the autonomous vehicle industry, giving Uber, which is losing ...",https://www.reuters.com/article/us-volvocars-uber-idUSKBN1DK1NH,"data:image/gif;base64,R0lGODlhAQABAIAAAP///////yH5BAEKAAEALAAAAAABAAEAAAICTAEAOw=="
