,title,media,date,datetime,desc,link,img
169,"The Economic Impact of Autonomous Vehicles: More Jobs, And Another $7 Trillion for the World Economy",WIRED,"Jun 3, 2017",2017-06-03 00:00:00.000000,"Mention autonomous vehicles, and people conjure two visions of the future. The rosy picture features a world in which cars zip around by themselves, ...",https://www.wired.com/2017/06/impact-of-autonomous-vehicles/,"data:image/gif;base64,R0lGODlhAQABAIAAAP///////yH5BAEKAAEALAAAAAABAAEAAAICTAEAOw=="
170,Waymo’s autonomous cars have driven 20 million miles on public roads,VentureBeat,"Jan 6, 2020",2020-01-06 00:00:00.000000,Waymo today announced that its autonomous cars have driven tens of billions of miles through computer simulations and 20 million miles on public roads in 25 ...,https://venturebeat.com/2020/01/06/waymos-autonomous-cars-have-driven-20-million-miles-on-public-roads/,"data:image/gif;base64,R0lGODlhAQABAIAAAP///////yH5BAEKAAEALAAAAAABAAEAAAICTAEAOw=="
171,Toyota to Temporarily Halt Driverless-Car Testing in U.S.,The Wall Street Journal,"Mar 20, 2018",2018-03-20 00:00:00.000000,Suspension follows pedestrian death by Uber self-driving car in Arizona. Toyota presented its electric powered and autonomous driving Concept- ...,https://www.wsj.com/articles/toyota-to-temporarily-halt-driverless-car-testing-in-u-s-1521570024,"data:image/gif;base64,R0lGODlhAQABAIAAAP///////yH5BAEKAAEALAAAAAABAAEAAAICTAEAOw=="
172,Philip Hammond pledges driverless cars by 2021 and warns people to retrain,The Guardian,"Nov 23, 2017",2017-11-23 00:00:00.000000,UK chancellor says driverless vehicles will revolutionise people's lives but says for some it will be 'very challenging'. An autonomous self-driving vehicle.,https://www.theguardian.com/world/2017/nov/23/philip-hammond-pledges-driverless-cars-by-2021-and-warns-people-to-retrain,"data:image/gif;base64,R0lGODlhAQABAIAAAP///////yH5BAEKAAEALAAAAAABAAEAAAICTAEAOw=="
173,Toyota's Vision of Autonomous Cars Is Not Exactly Driverless,Bloomberg.com,"Sep 19, 2018",2018-09-19 00:00:00.000000,"Toyota's self-driving vision isn't really about getting rid of drivers. Rather, it's about using autonomous and related technologies to make cars safer and more ...",https://www.bloomberg.com/news/features/2018-09-19/toyota-s-vision-of-autonomous-cars-is-not-exactly-driverless,"data:image/gif;base64,R0lGODlhAQABAIAAAP///////yH5BAEKAAEALAAAAAABAAEAAAICTAEAOw=="
174,How Driverless Cars May Interact With People,The New York Times,"Aug 30, 2016",2016-08-30 00:00:00.000000,"Now a start-up called Drive.ai, based in Mountain View, Calif., is trying to address how an autonomous car would communicate with other drivers and ...",https://www.nytimes.com/2016/08/31/technology/how-driverless-cars-may-interact-with-people.html,"data:image/gif;base64,R0lGODlhAQABAIAAAP///////yH5BAEKAAEALAAAAAABAAEAAAICTAEAOw=="
175,Waymo urges U.S. to 'promptly' remove barriers to self-driving cars,Reuters,"Aug 29, 2019",2019-08-29 00:00:00.000000,"WASHINGTON (Reuters) - Waymo, the self-driving car unit of Google parent Alphabet Inc, on Thursday urged the National Highway Traffic Safety Administration ...",https://www.reuters.com/article/us-autos-selfdriving-regulation-idUSKCN1VJ2RF,"data:image/gif;base64,R0lGODlhAQABAIAAAP///////yH5BAEKAAEALAAAAAABAAEAAAICTAEAOw=="
176,Cruise acquires Voyage in another autonomous vehicle merger,The Verge,"Mar 15, 2021",2021-03-15 00:00:00.000000,"Cruise mainly operates its autonomous vehicles in dense, urban settings like downtown San Francisco, while Voyage oversees a fleet of low-speed autonomous ...",https://www.theverge.com/2021/3/15/22331794/cruise-acquires-voyage-self-driving-car-merger,"data:image/gif;base64,R0lGODlhAQABAIAAAP///////yH5BAEKAAEALAAAAAABAAEAAAICTAEAOw=="
177,"Israel's Mobileye, Dubai's Habtoor partner on self-driving cars",Reuters,"Sep 23, 2020",2020-09-23 00:00:00.000000,"Jerusalem-based Mobileye, Intel Corp's autonomous car division, already has agreements to deploy its technology in cities in Japan, South Korea, France and ...",https://www.reuters.com/article/us-israel-gulf-intel-habtoor-idUSKCN26E207,"data:image/gif;base64,R0lGODlhAQABAIAAAP///////yH5BAEKAAEALAAAAAABAAEAAAICTAEAOw=="
178,Baidu launches public road tests of autonomous cars in China,Financial Times,"Nov 23, 2017",2017-11-23 00:00:00.000000,"Analysts view Baidu, with its open source Apollo software, as the leader in driverless car technology in China. Baidu tests driverless cars on a 3km stretch of ...",https://www.ft.com/content/8c506d06-d02d-11e7-b781-794ce08b24dc,"data:image/gif;base64,R0lGODlhAQABAIAAAP///////yH5BAEKAAEALAAAAAABAAEAAAICTAEAOw=="
179,"G.M. Unveils Its Driverless Cars, Aiming to Lead the Pack",The New York Times,"Nov 29, 2017",2017-11-29 00:00:00.000000,"Industry analysts say autonomous vehicles could generate billions of dollars in additional revenue and profit for automakers and technology companies, primarily ...",https://www.nytimes.com/2017/11/29/business/gm-driverless-cars.html,"data:image/gif;base64,R0lGODlhAQABAIAAAP///////yH5BAEKAAEALAAAAAABAAEAAAICTAEAOw=="
180,"Ford’s autonomous vehicles are coming to Austin, Texas",The Verge,"Sep 25, 2019",2019-09-25 00:00:00.000000,None of Ford's vehicles are fully driverless; the company keeps two safety drivers in each vehicle at all times. Ford is also working on a purpose-built self- ...,https://www.theverge.com/2019/9/25/20882724/ford-autonomous-cars-vehicles-av-austin-texas-taxi-delivery,"data:image/gif;base64,R0lGODlhAQABAIAAAP///////yH5BAEKAAEALAAAAAABAAEAAAICTAEAOw=="
181,We still can’t agree how to regulate self-driving cars,The Verge,"Feb 11, 2020",2020-02-11 00:00:00.000000,"And they want to preempt states and cities from passing laws regarding autonomous vehicles. On the flip side are safety advocates, trial lawyers, and local ...",https://www.theverge.com/2020/2/11/21133389/house-energy-commerce-self-driving-car-hearing-bill-2020,"data:image/gif;base64,R0lGODlhAQABAIAAAP///////yH5BAEKAAEALAAAAAABAAEAAAICTAEAOw=="
182,The road ahead: self-driving cars on the brink of a revolution in California,The Guardian,"Mar 17, 2017",2017-03-17 00:00:00.000000,"But this month, California set the stage for the next phase of innovation that could dramatically alter transportation and mobility across the globe. The state ...",https://www.theguardian.com/technology/2017/mar/17/self-driving-cars-california-regulation-google-uber-tesla,"data:image/gif;base64,R0lGODlhAQABAIAAAP///////yH5BAEKAAEALAAAAAABAAEAAAICTAEAOw=="
183,"Alphabet's Waymo Tests Pricing, Teams Up With Public Transit",Bloomberg.com,"Jul 31, 2018",2018-07-31 00:00:00.000000,"Samantha Jackson, right, and her daughter Kyla, 17, with a Waymo autonomous vehicle. The Jackson family has volunteered to be part of Waymo's Early Rider ...",https://www.bloomberg.com/news/features/2018-07-31/inside-the-life-of-waymo-s-driverless-test-family,"data:image/gif;base64,R0lGODlhAQABAIAAAP///////yH5BAEKAAEALAAAAAABAAEAAAICTAEAOw=="
184,Waymo pulls back the curtain on 6.1 million miles of self-driving car data in Phoenix,The Verge,"Oct 30, 2020",2020-10-30 00:00:00.000000,"In its first report on its autonomous vehicle operations in Phoenix, Arizona, ... Waymo says its intention is to build public trust in automated vehicle ...",https://www.theverge.com/2020/10/30/21538999/waymo-self-driving-car-data-miles-crashes-phoenix-google,"data:image/gif;base64,R0lGODlhAQABAIAAAP///////yH5BAEKAAEALAAAAAABAAEAAAICTAEAOw=="
185,71 Percent of Americans Still Don't Trust Autonomous Cars According to New Survey,Gizmodo,"Mar 14, 2019",2019-03-14 00:00:00.000000,"Most Americans are terrified of riding in autonomous vehicles, according to a new survey released by AAA. And rather than getting more comfortable with the ...",https://gizmodo.com/71-percent-of-americans-still-dont-trust-autonomous-car-1833284527,"data:image/gif;base64,R0lGODlhAQABAIAAAP///////yH5BAEKAAEALAAAAAABAAEAAAICTAEAOw=="
186,Making Money On Self-Driving Cars: The Roving Eye Will Be ...,Forbes,"Jun 11, 2019",2019-06-11 00:00:00.000000,"Pundits are expecting that once the human driver of the ridesharing car is excised from the deal, which presumably will take place once autonomous cars are safe ...",https://www.forbes.com/sites/lanceeliot/2019/06/11/making-money-on-self-driving-cars-the-roving-eye-will-be-golden/,"data:image/gif;base64,R0lGODlhAQABAIAAAP///////yH5BAEKAAEALAAAAAABAAEAAAICTAEAOw=="
187,From Model T to driverless: Ford to launch fleet of robot cars in Washington,The Washington Post,"Oct 22, 2018",2018-10-22 00:00:00.000000,From Model T to driverless: Ford to launch fleet of robot cars in Washington ... benefits from autonomous vehicles are racing to improve their systems and ...,https://www.washingtonpost.com/local/trafficandcommuting/from-model-t-to-driverless-ford-to-launch-fleet-of-robot-cars-in-washington/2018/10/21/6d98119e-d2f6-11e8-b2d2-f397227b43f0_story.html,"data:image/gif;base64,R0lGODlhAQABAIAAAP///////yH5BAEKAAEALAAAAAABAAEAAAICTAEAOw=="
188,"Wielding Rocks and Knives, Arizonans Attack Self-Driving Cars",The New York Times,"Dec 31, 2018",2018-12-31 00:00:00.000000,"The slashing was one of nearly two dozen attacks on driverless vehicles over the past two years in Chandler, a city near Phoenix where Waymo started testing ...",https://www.nytimes.com/2018/12/31/us/waymo-self-driving-cars-arizona-attacks.html,"data:image/gif;base64,R0lGODlhAQABAIAAAP///////yH5BAEKAAEALAAAAAABAAEAAAICTAEAOw=="
189,Inside Honda's ghost town for testing autonomous cars,Engadget,"Jun 2, 2016",2016-06-02 00:00:00.000000,Just because autonomous vehicles are hitting the streets doesn't mean the funding needed to fix all the potholes and faded lane markers will magically ...,https://www.engadget.com/2016-06-02-inside-honda-gomentum-station.html,"data:image/gif;base64,R0lGODlhAQABAIAAAP///////yH5BAEKAAEALAAAAAABAAEAAAICTAEAOw=="
190,IIHS Study: Autonomous Cars Won't Avoid Majority of Vehicle Crashes,Car and Driver,"Jun 7, 2020",2020-06-07 00:00:00.000000,"The general consensus has been that once autonomous cars take over the roads, car accidents will almost be a thing of the past. But according to a new study ...",https://www.caranddriver.com/news/a32783046/iihs-autonomous-cars-not-as-safe-study/,"data:image/gif;base64,R0lGODlhAQABAIAAAP///////yH5BAEKAAEALAAAAAABAAEAAAICTAEAOw=="
191,Uber suspends self-driving car program after Arizona crash,Reuters,"Mar 25, 2017",2017-03-25 00:00:00.000000,March 25 (Reuters) - Uber Technologies Inc suspended its pilot program for driverless cars on Saturday after a vehicle equipped with the nascent technology ...,https://www.reuters.com/article/uber-tech-crash-idUSL2N1H20DE,"data:image/gif;base64,R0lGODlhAQABAIAAAP///////yH5BAEKAAEALAAAAAABAAEAAAICTAEAOw=="
192,GM's Ammann says company moving 'really quickly' on autonomous cars,Reuters,"Oct 17, 2017",2017-10-17 00:00:00.000000,"As to when GM's autonomous cars will be ready for prime time, Ammann was elusive. “We will see some pretty interesting developments” by 2021, he said.",https://www.reuters.com/article/wsjd-conference-gm/gms-ammann-says-company-moving-really-quickly-on-autonomous-cars-idUSL2N1MS2BF,"data:image/gif;base64,R0lGODlhAQABAIAAAP///////yH5BAEKAAEALAAAAAABAAEAAAICTAEAOw=="
193,Are self-driving cars the future of mobility for disabled people?,The Conversation,"Oct 5, 2017",2017-10-05 00:00:00.000000,Self-driving cars could revolutionize how disabled people get around their ... Autonomous vehicle technology on its own is not enough to help these people ...,https://theconversation.com/are-self-driving-cars-the-future-of-mobility-for-disabled-people-84037,"data:image/gif;base64,R0lGODlhAQABAIAAAP///////yH5BAEKAAEALAAAAAABAAEAAAICTAEAOw=="
194,Renault-Nissan alliance plans self-driving cars over next four years,Reuters,"Jan 7, 2016",2016-01-07 00:00:00.000000,The alliance also said it hired technology executive Ogi Redzic to lead its connected car efforts as senior vice president for connected vehicles and mobility ...,https://www.reuters.com/article/us-autos-nissan-autonomous-idUSKBN0UL23F20160107,"data:image/gif;base64,R0lGODlhAQABAIAAAP///////yH5BAEKAAEALAAAAAABAAEAAAICTAEAOw=="
195,Pony.ai and Toyota partner to build self-driving cars and services,VentureBeat,"Aug 25, 2019",2019-08-25 00:00:00.000000,"Guangzhou, China-based self-driving car startup Pony.ai today announced that it ... The pair aims to build level 4 autonomous cars — able to operate without ...",https://venturebeat.com/2019/08/25/pony-ai-toyota-partnership/,"data:image/gif;base64,R0lGODlhAQABAIAAAP///////yH5BAEKAAEALAAAAAABAAEAAAICTAEAOw=="
196,Apple scientists disclose self-driving car research,Reuters,"Nov 21, 2017",2017-11-21 00:00:00.000000,"... pedestrians while using fewer sensors has been posted online, in what appears to be the company's first publicly disclosed paper on autonomous vehicles.",https://www.reuters.com/article/us-apple-autos-idUSKBN1DM08H,"data:image/gif;base64,R0lGODlhAQABAIAAAP///////yH5BAEKAAEALAAAAAABAAEAAAICTAEAOw=="
197,"Self-driving cars by 2021: PHOTOS, FEATURES",Business - Insider,"Jan 12, 2017",2017-01-12 00:00:00.000000,Uber and Volvo have also agreed to a $300 million alliance to develop driverless cars. Uber has made a play for the self-driving car space by poaching staff ...,https://www.businessinsider.com/companies-making-driverless-cars-by-2020-2017-1,"data:image/gif;base64,R0lGODlhAQABAIAAAP///////yH5BAEKAAEALAAAAAABAAEAAAICTAEAOw=="
198,Donald Trump reportedly hates self-driving cars,Business - Insider,"Mar 18, 2019",2019-03-18 00:00:00.000000,Four sources told the news website Axios that President Donald Trump had a deep mistrust of driverless cars. Trump sometimes imagines scenes in which the cars ...,https://www.businessinsider.com/donald-trump-hates-self-driving-cars-axios-reports-2019-3,"data:image/gif;base64,R0lGODlhAQABAIAAAP///////yH5BAEKAAEALAAAAAABAAEAAAICTAEAOw=="
199,Ford used fake driverless car in DC for experiment,Business - Insider,"Sep 13, 2017",2017-09-13 00:00:00.000000,"""This seat suit allowed us to collect real-world reactions to an autonomous vehicle driving on miles of public roads in northern Virginia, without actually ...",https://www.businessinsider.com/ford-used-fake-driverless-car-dc-experiment-2017-9,"data:image/gif;base64,R0lGODlhAQABAIAAAP///////yH5BAEKAAEALAAAAAABAAEAAAICTAEAOw=="
200,"Lidar tech on the rise at CES to power future smart cities, autonomous cars",The Washington Post,"Jan 16, 2021",2021-01-16 00:00:00.000000,"Lidar tech on the rise at CES to power future smart cities, autonomous cars. Seoul Robotics and Intel's Mobileye among firms with new 3-D technology to support ...",https://www.washingtonpost.com/technology/2021/01/16/lidar-smart-cities-autonomous-cars/,"data:image/gif;base64,R0lGODlhAQABAIAAAP///////yH5BAEKAAEALAAAAAABAAEAAAICTAEAOw=="
201,A top futurist predicts driverless cars will kill at least 128 different types of jobs,Business - Insider,"Dec 21, 2016",2016-12-21 00:00:00.000000,"In the blog post, Frey describes a reality in which autonomous vehicles will be pervasive in all aspects of transportation, agriculture, construction, and ...",https://www.businessinsider.com/a-top-futurist-says-driverless-cars-will-kill-128-kinds-of-jobs-2016-12,"data:image/gif;base64,R0lGODlhAQABAIAAAP///////yH5BAEKAAEALAAAAAABAAEAAAICTAEAOw=="
202,Apple-Owned Lexus Car With Self-Driving Tech Sensors ...,Business - Insider,"Apr 28, 2017",2017-04-28 00:00:00.000000,A Lexus vehicle vehicle outfitted with sensors was spotted driving around ... a third-party company that builds the sensors used in autonomous vehicles.,https://www.businessinsider.com/apple-lexus-car-self-driving-tech-sensors-spotted-silicon-valley-2017-4,"data:image/gif;base64,R0lGODlhAQABAIAAAP///////yH5BAEKAAEALAAAAAABAAEAAAICTAEAOw=="
203,Explaining Level 4 And Level 5 Of Self-Driving Cars In Plain ...,Forbes,"Dec 20, 2019",2019-12-20 00:00:00.000000,"Since semi-autonomous cars require a human driver, the adoption of those types of cars won't be markedly different than driving conventional vehicles, so I'm ...",https://www.forbes.com/sites/lanceeliot/2019/12/20/explaining-level-4-and-level-5-of-self-driving-cars-in-plain-english/,"data:image/gif;base64,R0lGODlhAQABAIAAAP///////yH5BAEKAAEALAAAAAABAAEAAAICTAEAOw=="
204,"Mobile Robots, Autonomous Vehicles, and Drones in Logistics ...",IDTechEx,"Nov 26, 2019",2019-11-26 00:00:00.000000,"Automated guided vehicles/carts; autonomous industrial material handling vehicles, goods-to-person robots, collaborative autonomous mobile robots, mobile ...",https://www.idtechex.com/en/research-report/mobile-robots-autonomous-vehicles-and-drones-in-logistics-warehousing-and-delivery-2020-2040/706,"data:image/gif;base64,R0lGODlhAQABAIAAAP///////yH5BAEKAAEALAAAAAABAAEAAAICTAEAOw=="
205,5 reasons why self-driving cars are still not on our roads,RTE,"Aug 10, 2020",2020-08-10 00:00:00.000000,"From RTÉ Radio 1's Morning Ireland, would you trust a driverless car? There are indeed still fundamental challenges to the safe introduction of fully autonomous ...",https://www.rte.ie/brainstorm/2020/0804/1157190-self-driving-cars-autonomous-cars-sensors-social-acceptability-safety/,"data:image/gif;base64,R0lGODlhAQABAIAAAP///////yH5BAEKAAEALAAAAAABAAEAAAICTAEAOw=="
206,Is Baidu better than Waymo?,South China Morning Post,"Feb 29, 2020",2020-02-29 00:00:00.000000,"Last year in California, safety drivers in Waymo's autonomous vehicles took over ... human intervention in its autonomous cars only once every 18,000 miles.",https://www.scmp.com/abacus/tech/article/3052979/did-baidu-really-do-better-googles-waymo-californias-self-driving,"data:image/gif;base64,R0lGODlhAQABAIAAAP///////yH5BAEKAAEALAAAAAABAAEAAAICTAEAOw=="
207,Self-driving cars to ‘revolutionise’ UK roads by 2021,,"Nov 7, 2017",2017-11-07 00:00:00.000000,"I want to see that revolution be happening by then.” A host of car manufacturers and tech companies are working on designs for autonomous vehicles. Some, like ...",https://www.scotsman.com/news/transport/self-driving-cars-revolutionise-uk-roads-2021-2458939,"data:image/gif;base64,R0lGODlhAQABAIAAAP///////yH5BAEKAAEALAAAAAABAAEAAAICTAEAOw=="
208,Magna pitches new self-driving vehicle system,Reuters,"Aug 31, 2017",2017-08-31 00:00:00.000000,Magna is one of several major automotive technology suppliers competing to profit from helping automakers offer automated driving functions in future cars.,https://www.reuters.com/article/us-autos-magna-intl-selfdriving-idUSKCN1BB14X,"data:image/gif;base64,R0lGODlhAQABAIAAAP///////yH5BAEKAAEALAAAAAABAAEAAAICTAEAOw=="
209,Tesla on autopilot hits Michigan state trooper's patrol car | TheHill,TheHill,"Mar 17, 2021",2021-03-17 00:00:00.000000,"A self-driving Tesla automobile struck a Michigan state trooper's vehicle early ... have ""1 million autonomous robo-taxis"" on the road by the end of 2020, ...",https://thehill.com/policy/transportation/automobiles/543593-michigan-state-trooper-hit-by-tesla-on-autopilot,"data:image/gif;base64,R0lGODlhAQABAIAAAP///////yH5BAEKAAEALAAAAAABAAEAAAICTAEAOw=="
210,Uber to Study Dallas Streets As Potential Self-Driving Car ...,Business - Insider,"Sep 18, 2019",2019-09-18 00:00:00.000000,The company says it will send manual drivers in November to collect data that will power computer simulations and ultimately decide whether or not ...,https://www.businessinsider.com/uber-self-driving-study-dallas-potential-market-2019-9,"data:image/gif;base64,R0lGODlhAQABAIAAAP///////yH5BAEKAAEALAAAAAABAAEAAAICTAEAOw=="
211,Teen Programmer Uses Real Self-Driving Car Tech in 'GTA V',VICE,"May 19, 2020",2020-05-19 00:00:00.000000,"Cars that can drive themselves in certain situations are an expensive luxury, but programmers, hobbyists, and gearheads across the world are working to ...",https://www.vice.com/en/article/4aydxn/teen-programmer-uses-real-self-driving-car-tech-in-gta-v,"data:image/gif;base64,R0lGODlhAQABAIAAAP///////yH5BAEKAAEALAAAAAABAAEAAAICTAEAOw=="
212,What Uber Employees Worry About,Business - Insider,"Aug 25, 2016",2016-08-25 00:00:00.000000,"One person worried that once self driving cars are a regular thing and Uber owns a fleet of them, Uber will become like an airline, including the low profit ...",https://www.businessinsider.com/what-uber-employees-worry-about-2016-8,"data:image/gif;base64,R0lGODlhAQABAIAAAP///////yH5BAEKAAEALAAAAAABAAEAAAICTAEAOw=="
213,Apple Should Not Buy Tesla,Business - Insider,"Mar 10, 2015",2015-03-10 00:00:00.000000,"... about Apple's Project Titan, which could be a car — perhaps a driverless car, ... Apple is certainly full of guys who dig cars and want to reinvent them ...",https://www.businessinsider.com/apple-should-not-buy-tesla-2015-3,"data:image/gif;base64,R0lGODlhAQABAIAAAP///////yH5BAEKAAEALAAAAAABAAEAAAICTAEAOw=="
214,Uber's biggest potential competitor is over 100 years old,Business - Insider,"Feb 4, 2016",2016-02-04 00:00:00.000000,"And if over the next decade, a shift to autonomous cars takes place, Uber — if it's still around — will need to provide that type of vehicle.",https://www.businessinsider.com/ubers-biggest-potential-competitor-is-over-100-years-old-2016-2,"data:image/gif;base64,R0lGODlhAQABAIAAAP///////yH5BAEKAAEALAAAAAABAAEAAAICTAEAOw=="
215,Google and Facebook boost federal lobbying in 2nd qtr,Reuters,"Jul 23, 2012",2012-07-23 00:00:00.000000,"Google, which is developing self-driving cars that it hopes will someday be ... in a section on lobbying that included “autonomous vehicle technology.”.",https://www.reuters.com/article/google-lobbying-idUSL2E8INHFA20120723,"data:image/gif;base64,R0lGODlhAQABAIAAAP///////yH5BAEKAAEALAAAAAABAAEAAAICTAEAOw=="
216,Car Ratings Car Shopping Guides What Does ADAS Stand For?,J.D. Power,"Sep 21, 2020",2020-09-21 00:00:00.000000,"These systems use cameras, radar, LiDAR, vehicle-to-X communication, ... and doze off unless your car has Level 5, fully-autonomous self-driving capability.",https://www.jdpower.com/cars/shopping-guides/what-does-adas-stand-for,"data:image/gif;base64,R0lGODlhAQABAIAAAP///////yH5BAEKAAEALAAAAAABAAEAAAICTAEAOw=="
217,Electrical & Computer Engineering | Academics | WPI,Worcester Polytechnic Institute,"Aug 30, 2016",2016-08-30 00:00:00.000000,"... signal processing, autonomous vehicles, smart health, prosthetic control, analog and digital microelectronics, and wireless information networks.",https://www.wpi.edu/academics/departments/electrical-computer-engineering,"data:image/gif;base64,R0lGODlhAQABAIAAAP///////yH5BAEKAAEALAAAAAABAAEAAAICTAEAOw=="
218,Why EV Battery Design Is So Difficult,Semiconductor Engineering,"Oct 3, 2019",2019-10-03 00:00:00.000000,"Autonomous vehicles make this much more complicated. ... We wanted the car to be able to race on the track, and that takes a lot of power and design, ...",https://semiengineering.com/why-ev-battery-design-is-so-difficult/,"data:image/gif;base64,R0lGODlhAQABAIAAAP///////yH5BAEKAAEALAAAAAABAAEAAAICTAEAOw=="
219,"Baidu, Geely tap Mobike’s co-founder as CEO of electric car venture",South China Morning Post,"Feb 19, 2021",2021-02-19 00:00:00.000000,"to produce electric vehicles by leveraging its capabilities in autonomous driving technologies and Geely's expertise in car design and manufacturing. Robin Li, ...",https://www.scmp.com/business/companies/article/3122351/china-electric-cars-baidu-and-geely-hire-mobikes-co-founder,"data:image/gif;base64,R0lGODlhAQABAIAAAP///////yH5BAEKAAEALAAAAAABAAEAAAICTAEAOw=="
220,"Lyft sees 'peak losses' this year, says ride hailing has path to profit",Reuters,"May 7, 2019",2019-05-07 00:00:00.000000,"New technology to match drivers and riders, and higher-priced rides in luxury vehicles were helping boost margins, it said. Lyft said its adjusted EBITDA ...",https://www.reuters.com/article/us-lyft-results-idUSKCN1SD22F,"data:image/gif;base64,R0lGODlhAQABAIAAAP///////yH5BAEKAAEALAAAAAABAAEAAAICTAEAOw=="
221,PRESS DIGEST - Wall Street Journal - Jan 4,Reuters,"Jan 3, 2017",2017-01-03 00:00:00.000000,Ford Motor Co scrapped a plan to build a $1.6 billion small-car factory in ... Lawyers representing owners of tainted Volkswagen diesel-powered cars in ...,https://www.reuters.com/article/press-digest-wsj-idINL4N1EU1U2,"data:image/gif;base64,R0lGODlhAQABAIAAAP///////yH5BAEKAAEALAAAAAABAAEAAAICTAEAOw=="
222,"2021 Tesla Model 3 Review, Pricing, and Specs",Car and Driver,"Feb 18, 2021",2021-02-18 00:00:00.000000,Standard automated emergency braking; Standard lane-departure warning; Standard adaptive cruise control. Warranty and Maintenance Coverage. Tesla's overall ...,https://www.caranddriver.com/tesla/model-3,"data:image/gif;base64,R0lGODlhAQABAIAAAP///////yH5BAEKAAEALAAAAAABAAEAAAICTAEAOw=="
223,Lyft is IPOing with a 'golden opportunity' in a $1.2 trillion ...,Markets Insider,"Mar 28, 2019",2019-03-28 00:00:00.000000,"""The full amount is disrupted would mean consumers stop spending on cars ... Lyft is developing a fleet of autonomous vehicles in Las Vegas but is far ...",https://markets.businessinsider.com/news/stocks/lyft-golden-opportunity-in-12-trillion-market-but-faces-4-key-risks-2019-3,"data:image/gif;base64,R0lGODlhAQABAIAAAP///////yH5BAEKAAEALAAAAAABAAEAAAICTAEAOw=="
224,Ford more confident of stronger 2019 despite 'volatile environment',Reuters,"Apr 25, 2019",2019-04-25 00:00:00.000000,... to kill off most of its unprofitable passenger cars in the U.S. market meant that ... to include electric and autonomous vehicles and mobility services.,https://www.reuters.com/article/us-ford-motor-results-idUSKCN1S12L7,"data:image/gif;base64,R0lGODlhAQABAIAAAP///////yH5BAEKAAEALAAAAAABAAEAAAICTAEAOw=="
